30101	INTERACTIVE_LISTENING	Interactive Listening	- Intensive listening⏎- Listening w/ Lookups⏎- Corrected Listening⏎- Noticing Game (audio) w/ Confirmation	Listening to something and relistening when needed, pausing or looking up.	Listening to something without the aid of any text (includes TV shows, podcasts, audiobooks, etc.), but doing your best to understand as much as possible by replaying sections you find difficult, looking up new words, and other interactive activities.	Expand your abilities in the language;Understand more than you could without lookups;Solidify knowledge learned from priming and freeflow	Interactive Listening is a broad category of activities. But they all share the same core: you're listening to something (without any text) and are stopping to look up or puzzle out new words or concepts. Interactive Listening is best done with tools or by using subtitles to help you quickly verify what you heard.	Interactive listening (without any text) is a great activity to do, but isn't recommended for beginners. The lack of text makes it a lot harder to follow along with the content and understand enough of the language.⏎⏎Once you're in the listening stages of learning, you should be doing as much interactive listening as possible! Listening is a very hard skill to develop, but with the right interactive techniques, you'll surprise even yourself!	Interactive immersion in general can be intense and difficult. It might feel like your brain is melting. This is normal! But you should be prepared for it. Don't plan to do interactive immersion when you're exhausted after a long day. Find when you have the most learning energy and do it then.		For a more specific guide, check a technique that falls into this category.		3;4;5;6;7	https://youtu.be/lN0Gr-dbdbc	https://youtu.be/knbVk_5k3lU	Category	Listening, Watching	Listening, Watching	Interactive	Transcription; Listen Looping; Crosstalk; Chorusing; Shadowing; Sentence Mining (While Listening); Intensive Listening			
30104	FREEFLOW_LISTENING	Freeflow Listening	- Pure listening⏎- Extensive listening⏎- Noticing game (audio)	Focused listening to something (no text) without pausing.	Listening to something without any text and simply trying to understand as much as you can, without the aid of tools or pausing or anything. This is the best way to get in massive amounts of immersion, since you don't need to do much. However, make sure that you're understanding enough, or else you might not make the progress you're hoping for!	Strengthen knowledge you have;Learn new words through exposure;Easy to spend lots of time with the language	Freeflow Listening is a broad category of activities. But they all share the same core: you're listening to or watching something (without any text), and aren't stopping to look up or puzzle out new words or concepts. You just keep on listening. Once you're at a good enough level to be able to do this and understand a lot, it's the easiest way to get a massive amount of exposure to the language.	When you're able to understand 80%+ of content, just from listening, it's a good idea to start incorporating it into your routine. It's easy to do a lot of freeflow listening, since you can do it while doing other things (walking, cleaning, laying down and just staring at the ceiling), or even do it while tired. Advanced learners get the most benefit from freeflow listening, but starting to practice the skill in the intermediate stages is a good idea.	Many learners do too much freeflow in the beginner stages and become frustrated with their progress. It's easy to do a lot of freeflow, which feels like you're doing a lot of learning, but when your progress doesn't match, it's very frustrating. This is especially true with pure audio freeflow, since it's very hard to understand and follow the plot if you can't pick out at least 80% of the words. To get to that point, make sure your freeflow is balanced with priming and interactive immersion.		For a more specific guide, check a technique that falls into this category.		3;4;5;6;7	https://youtu.be/w3F93GSfmR0	na	Category	Listening, Watching	Listening, Watching	Freeflow	Half-attention Listening			
30107	LISTEN_LOOPING	Listen Looping	- Interactive listening⏎- Intensive Listening⏎- Listening w/ Lookups⏎- Corrected Listening	Using audio software to listen repeatedly to difficult sections.	Listen looping is a simple activity that can help you to understand way more than you thought you could. All you need is a way to listen to sections of audio over and over again (hence the name looping). When you find sections you think you might be able to understand, looping them a few times can reveal the meaning!	Train your ears to hear things you know;Adapt your listening to real speech;Uncover new parts of the spoken language	This a simple activity which trains your ears to hear better!	When you're focusing on your listening skills, a little daily listen looping goes a long way. You don't need to spend more than 10-20 minutes on it to get a lot of benefit.	Listen looping is only really possible with a special audio editing tool. These tools usually have a learning curve and are a bit clunky. If you find yourself frustrated with the software, take a break and try again in a few minutes or the following day.	To do listen looping, you'll need some kind of audio editing tool. Audacity is recommended since it's free, but anything works. You don't need any of the editing features, it's just nice to be able to easily select and loop sections of the audio, which is hard with a regular mp3 player.	To start, load in an audio clip. It can be anything, but downloading a podcast or YouTube video or even audiobook can all work. Really long files will take longer to load, so keep that in mind.⏎⏎Start listening to the file and take a minute or two to focus on what the speaker is saying and get into the rhythm. Then, start listening for sections that you don't understand, but that you think you might be able to. If you clearly hear a bunch of words you don't know, skip that. We want to find a bit that's hard to hear because it's too fast, or the words are mushed together or something like that.⏎⏎When you find a section like that, select it and play it a few times. If your audio tool has a loop function, you can put the section on loop so you hear it over and over again. Try your best to really hear what's being said. If you want, you can make this into a transcription exercise and write down what you hear.⏎⏎Repeat the section a few times to see if you can hear exactly what's being said. When you get it, move on! The goal here is to give your brain and ears time to hone in on how things are being said by real speakers.	Optionally (and if you have this available to you), you can check a transcription to make sure you were correct.	3;4;6	https://youtu.be/g6B4JWAGpaM	https://youtu.be/e2vPjk9odPU	Technique	Listening	Listening	Interactive		Interactive Listening;Ear Training		
20201	ALPHABET_STUDY	Alphabet Study	- Script⏎- Script study⏎- Kana⏎- Pinyin⏎- Syllabary⏎- Abjad⏎- Writing system⏎- Phonetic writing system⏎- Study	Practicing, training or learning the alphabet* of your new language.	When learning a language with a new writing system (alphabet, syllabary, abjad, etc.), mastering the basics is key. Being able to read opens up the world of text and boosts learning effectiveness. Prioritize this early, then focus on reading practice to deepen your mastery.	Unlock the power of reading;Doesn't take much effort to make progress	There are many different ways to study a new language's alphabet (or other writing system). Typically, you'll find the best resources from long-time teachers of those languages who have helped hundreds of students to learn to read. Do some searching for apps, websites or even books that teach the writing system, try a few of them out, then pick your favorite.	You should only be doing alphabet study in the very beginning of your journey. It's to give you a base for your reading, but if you want to get good at reading, more study isn't the answer. More reading is! Study the basics of the writing system and practice using it. After a few days or weeks, you won't need to do this activity any more.	NOTE: If you're learning a language with characters (like Mandarin, Korean or Cantonese), this activity is not for you. There's a "character study" activity. However, if you're learning a system like Pinyin or Kana, that would be considered alphabet study.	The tool that you use to read isn't a critical decision point, you just need the basics, then lots of practice, which will come during your immersion.⏎⏎Do 10–20 minutes of alphabet study per day with your chosen tool until you're at least comfortable reading words (slowly) in the new language.		A few tips for alphabet study:⏎- If you're struggling to remember the sounds letters make, little mnemonics can help a lot!⏎- Don't try to memorize all the rules, especially if they seem pretty arbitrary. Your brain will learn to recognize the patterns from exposure, not memorization.⏎- Be consistent with your study, but don't try to overload yourself. 10 minutes per day for a few weeks is a better approach than trying to do it all in 1 day.⏎- Don't be too hard on yourself if you're a very slow reader. Learning to process new representations of a language is hard!	1	https://youtu.be/Yjt7dCTPZwc	https://youtu.be/Mq64SzschXY	Category	Study	Study	Priming	#N/A			
30201	EAR_TRAINING	Ear training	- Sound priming⏎- Audio priming⏎- Sound study⏎- Sound preparation⏎- Audio preparation⏎- Phonology study⏎- Minimal Pairs⏎- Tones⏎- Pitch	Doing exercises to improve your ability to hear the language.	Every language has its own set of sounds, like a spoken alphabet. Your new language likely has sounds not in your native one. Our brains learn to ignore unfamiliar sounds, so you may struggle to hear new ones accurately. With practice, you can retrain your ears, improving listening skills and your accent and speech.	Train your ears to hear new sounds;Improve your listening and speaking	Ear training is a broad category of various techniques which all have to do with training your ears to better hear the language. A common example of ear training is "minimal pairs training" where you practice distinguishing between two very similar sounds that don't exist in your native language.	A little bit of ear training goes a long way. It can be done at different points in the learning process, but ideally you start doing it from the beginning. Training your ears early in the process helps avoid having to relearn things later.⏎⏎For languages that have very different sound systems from your native one, doing a solid 15-20 minutes of ear training per day for a few weeks can be really beneficial. But if your target language has a sound system that isn't too different, watching a few videos or doing a few minutes of training per day is more than enough to get the benefits.	Our brains literally learn to ignore sounds that aren't important for our native language. This means that there may be sounds you cannot hear the difference between. Trust the resources over your own ears and with time, you'll learn to distinguish them.⏎⏎Age plays a role in learning new sounds. It doesn't mean you're doomed to never being able to hear the sounds of your target language if you're over 40, but it does mean you'll need to pay special attention and do more practice than a teenager (damn kids).		Specific ear training methods vary between different languages and learning styles. Some methods/tools to look into are Fluent Forever, The Mimic Method, Tone Training, Minimal Pairs, or check out the Sound Study activity.		1;3;4;7	https://youtu.be/nwm16Hck8gk	https://youtu.be/7T_UTaDZ7WQ	Category	Study, Listening	Study, Listening	Priming	Transcription; Listen Looping; Sound study	Sound study		
40101	ASSISTED_WRITING	Assisted writing	- Corrected writing⏎- Intensive writing⏎- Interactive writing	Using tools while writing in your target language (like a dictionary).	Writing is tough (even in your native language) but practice makes you better. Writing in your target language improves grammar awareness and helps you express yourself clearly. "Assisted" writing uses tools like dictionaries, while writing without tools is called "unassisted."	Convert words you passively know into more active knowledge;Force yourself to think more slowly and methodically about the language;Train yourself to express your thoughts better	Just write! The more, the better. Assisted writing means that you're using tools to help you learn to write better. This means using a dictionary to find the right word or double-checking what grammar makes the most sense. But sometimes that's easier said than done.	Writing is best incorporated into your routine after speaking. Before you start writing a lot, you want to feel reasonably comfortable having a conversation. Before that, you'll likely overthink writing too much and become frustrated at the amount of errors and difficulty. ⏎⏎When you do start writing, though, it's an excellent way to put your brain into output mode and get a lot of good practice with the language. 20-40 minutes of writing per day goes a long way.	Before you start writing, you might find it helpful to do some Typing Practice or Handwriting Practice, so that you're not slowed down too much by your tools.	Find yourself a quiet and mostly distraction-free place to write, whether it's by hand or on a computer (or even your phone!). Remove as many distractions as you can and open a notepad. It's also worth choosing your writing tools beforehand (a good dictionary or site or even AI chatbot).	Then just start writing. It can be about whatever! The goal of assisted writing is to stretch yourself to write more and better than you could without any tools. So looking up words is a good thing. Or when you find a sentence that's hard for you to express, do your best then ask a chatbot to help you correct it. There's plenty of little things you can do to assist in your writing, so it's best to try a bunch of things and see what works for you.⏎⏎You can write a journal entry about your day, plan what you're going to do on the weekend, or complain about something in your life that's bothering you. If you're new at writing, it's a lot harder, but you'll get better with time.	Here are a few more tips:⏎- If you don't know how to type, check out Typing Practice (same goes for Handwriting Practice)!⏎- If you'd like to share your writing with others, making a simple (free) blog on Bearblog is a good choice, or Journaly is a multilingual mini blogging platform.⏎- Once you're in the flow of writing like this, you can work on writing a bigger "piece" over a longer period of time. Something like that makes for excellent material to bring to a class!⏎- When you find a new word or grammar pattern that you're struggling with, you can "mine" that and save it to Anki to review later	4;5;6;7	https://youtu.be/jgwVOADQl9E	https://youtu.be/mpRyX_NqWE0	Category	Writing	Writing	Interactive	#N/A			
40102	WRITING_ANALYSIS	Writing Analysis	- Editing⏎- Proof reading⏎- Proofing⏎- Writing review	Going over your own writing with tools and a critical eye.	Analyzing your writing helps identify mistakes and areas to improve, benefiting your overall language skills. You can analyze by self-editing, reviewing with a tutor, or using AI tools. Reflecting on and correcting mistakes boosts your language abilities.	Learn from your own mistakes;Find areas for further improvement	Analyzing your own writing is a fantastic way to improve and learn from your mistakes.	When you're trying to improve your output, getting corrections is critical! It can be overwhelming or emotionally heavy to be told where you're WRONG, but knowing what you can improve and seeing what would sound better/more natural is incredibly important for growth. After you've built baseline comfort in both your speaking and writing, start to incorporate a lot of analysis into your routine.	The most common issue is that taking corrections and analyzing your mistakes can be difficult. Being told where you're wrong can hurt! So go into this activity with improvement in mind and know that you already do so many things well. If you were actually terrible, fixing and improving individual mistakes wouldn't be worth it.⏎⏎Another issue that can come up is getting conflicting or overzealous feedback. Languages aren't math. There often isn't a single correct answer. If you are given a correction, it might be a personal preference, or part of a specific dialect, or only used in formal texts. There's a lot to keep in mind about corrections, so don't assume that there's always a right and wrong answer.		There are lots of different activities that would fall under "writing analysis," which will all vary slightly in how they look. Here are some tips:⏎- Simply rereading your own text and looking out for mistakes is great and easy to do! This kind of analysis helps you practice finding your own mistakes⏎- You can also do it during a lesson, with a tutor. Hearing their feedback, live, is an excellent way to dig into what you said that was incorrect and also verify that your writing makes sense⏎- AI writing correctors are also very good options, since they can be free and available any time of day. Just keep in mind that they're not actually intelligent, and can make mistakes, but they're good at catching and explaining basic things	Consistent writing analysis will help you to improve your writing, so keep at it consistently!	4;5;6;7	https://youtu.be/nnz2ZQQpnwc	https://youtu.be/nFVJ-cJFEpI	Category	Writing, Reading	Writing, Reading	Interactive	#N/A			
40103	UNASSISTED_WRITING	Unassisted writing	- freeflow writing	Writing in your target language without using a dictionary.	Writing is tough (even in your native language) but practice makes you better. Writing in your target language helps grammar awareness and clarity of thought. "Unassisted" writing means writing without tools or help. Using resources like dictionaries is "assisted writing."	Communicate using the language;Practice things you've been training;Get more extensive writing practice	Just write! The more, the better. Unassisted writing means that you're not using any tools to look up words or make sure your grammar is right (a spell checker doesn't count). But sometimes that's easier said than done.	Writing is best incorporated into your routine after speaking. Before you start writing a lot, you want to feel reasonably comfortable having a conversation. Before that, you'll likely overthink writing too much and become frustrated at the amount of errors and difficulty. ⏎⏎When you do start writing, though, it's an excellent way to put your brain into output mode and get a lot of good practice with the language. 20-40 minutes of writing per day goes a long way.	If you're struggling to think of words and feel like you can't express yourself, try Assisted Writing.⏎⏎Before you start writing, you might find it helpful to do some Typing Practice or Handwriting Practice, so that you're not slowed down too much by your tools.	Find yourself a quiet and mostly distraction-free place to write, whether it's by hand or on a computer (or even your phone!). Remove as many distractions as you can and open a notepad.	Then just start writing. If you know what you want to write about, that's great! But if not, start putting down random words. Start by introducing yourself or making up a pretend dialogue. The goal with unassisted writing is to get ideas down onto the page in your target language (so overthinking is your enemy).⏎⏎You can write a journal entry about your day, plan what you're going to do on the weekend, or complain about something in your life that's bothering you. If you're new at writing, it's a lot harder, but you'll get better with time. Don't worry too much about mistakes, you can do a Writing Analysis session to go back and fix those.	Writing is a pretty personal activity, so you're going to figure out the best way it works for you. But I've got a few more tips:⏎- If you don't know how to type, check out Typing Practice (same goes for Handwriting Practice)!⏎- If you'd like to share your writing with others, making a simple (free) blog on Bearblog is a good choice, or Journaly is a multilingual mini blogging platform.⏎- Once you're in the flow of writing like this, you can work on writing a bigger "piece" over a longer period of time. Something like that makes for excellent material to bring to a class!⏎- Writing long-form emails or messages to friends you know in your target language can be a great way to keep in touch with real people	5;6;7	https://youtu.be/zedRMgWO2cw	na	Technique	Writing	Writing	Freeflow		Writing Practice		
50101	CROSSTALK	Crosstalk	- Conversation⏎- Partner	Speaking with a partner, but each uses their native language.	Conversation requires two skills: speaking and understanding. It's easier to practice one at a time, starting with understanding. Crosstalk lets each person speak their native language, so you focus fully on comprehension, then respond comfortably in your own language. Ideal prep for real conversations.	Learn to have a conversation in a low-stress environment;Make friends in the language, even with a low level;Have deeper conversations than possible if only in the target language	Crosstalk is easy enough to understand, but takes a little getting used to. It's like a normal conversation, but you speak in your native language and understand in your target language (and your partner does the same).	Crosstalk is able to be done at any point in the learning process, from total beginner to very advanced! But it's most useful in the listening stage and as a way to make deeper connections with friends or relatives in your target language.	Convincing other people to try crosstalk can be a bit of a challenge, since most people don't know what it is. And when you do start crosstalking with someone, it can be hard to stay in separate languages. But gently remind them which language to speak in.	In crosstalk, you're having a normal conversation, but you are speaking in a different language than your speaking partner. You should both speak languages you're very comfortable with. So if you're a native English speaker learning Spanish, you would speak English and your partner would speak Spanish.	Crosstalk is a listening exercise, not exactly a speaking one. But it does help you lead up to speaking. The goal of crosstalk is to master the receptive side of a conversation. It's an excellent way to practice your understanding with a real person, who talks at a normal speed, directly to you.⏎⏎You can start having really fun and interesting crosstalk conversations very early in the learning process! Since you're able to express your thoughts easily, you can focus entirely on understanding the other person.	Look for native speakers of your target language who are learning your mother tounge. That's the best way to find willing crosstalk partners, and you might make a friend!⏎⏎Crosstalk can also be very helpful for family communication. If your partner or family speaks your target language and not much of your native language, it's often much easier to jump into crosstalk than into full on conversations in one language.	1;2;3;4	https://youtu.be/QD9x_gnFnyg	https://youtu.be/f-imnKleqBw	Technique	Listening	Listening	Interactive		Speaking Practice;Interactive Listening		
50103	SPEAKING_ALONE	Speaking alone	- Monologue⏎- Solo⏎- Single⏎- Self⏎- Narrate⏎- Reaction	Speaking on your own, for example, into a camera.	If you only practice speaking with a partner, you're missing out! Not only do you always need to find someone to talk to, you're only speaking for (around) 1/2 the time. But when you speak on your own, you can really let your thoughts fly. This can be something like talking to yourself or recording yourself for later analysis.	Easy to do with very little setup;Best way to get a lot of speaking practice;Train your comfort speaking aloud in a low-stress environment	There are many different ways to do "speaking alone," but they're all pretty simple. You just need to speak... alone!	When you're trying to improve your speaking, consistancy and momentum are very helpful. But scheduling a tutoring session every day can be time intensive, energy consuming and expensive! Speaking on your own can help you keep the daily momentum and give you a great place to practice without anyone else judging you. Speaking alone activities are great to work into your routine anytime in the output process.	The hardest part for most people is figuring out what to talk about! Talking about your day, any plans you have or random topics is great. But if you find your mind going blank, combine speaking with your input! Talk about something you're watching or reading in your target language and try to use words from those materials.		A few of the best ways to do this are:⏎- Video log (vlog). Set up a camera and record yourself speaking for 5–10 minutes. You don't need to publish it or anything, but having the recording can be really helpful for Speaking Analysis⏎- Narration. If you don't know what to talk about, you can narrate what you're doing in real time! Say what actions you're doing, what thoughts come to mind, anything! You may look a little crazy, but it's great practice⏎- Reacting. When you're watching a movie or video or something, you can react (aloud) and say what you see, what you think or really anything. The idea isn't to really watch whatever it is you have on, but to use it as inspiration of what to talk about		4;5;6;7	https://youtu.be/l-OhftySJYc	https://youtu.be/tWWsylxCGAU	Category	Speaking	Speaking	Freeflow	#N/A			
